asin,helpful,index,overall,overall_html,reviewText,reviewTime,reviewerID,reviewerName,sentiment,summarized_reviewText,summary,summary_sentiment,topic,topic_words,unixReviewTime
972683275,"{14,19}",141,5.0,"<span class=""fa fa-star checked""></span><span class=""fa fa-star checked""></span><span class=""fa fa-star checked""></span><span class=""fa fa-star checked""></span><span class=""fa fa-star checked""></span>","I mounted this in my RV and it holds a 26"" LCD TV / DVD combo.  Installation was very easy and the mount works GREAT!  I was prepared to pay 5 times the price for a mount that would work as I wanted.  I couldn't be happier.","09 30, 2010",A7R4R9THNELTP,LG,0.7929999999999999,"I mounted this in my RV and it holds a 26"" LCD TV / DVD combo. <span style=""background-color: #FFFF00"">Installation was very easy and the mount works GREAT!</span> <span style=""background-color: #FFFF00"">I was prepared to pay 5 times the price for a mount that would work as I wanted.</span> I couldn't be happier.","Excellent, at any price",0.298,1,work great,1285804800
972683275,"{0,0}",191,5.0,"<span class=""fa fa-star checked""></span><span class=""fa fa-star checked""></span><span class=""fa fa-star checked""></span><span class=""fa fa-star checked""></span><span class=""fa fa-star checked""></span>",This was for a 32 inch LCD.  Easy to install and works great.  I am very satisfied with this wall mount.,"08 26, 2012",A2EBPFXZNLL753,Rob A. Frese,0.8777,"This was for a 32 inch LCD. <span style=""background-color: #FFFF00"">Easy to install and works great.</span> I am very satisfied with this wall mount.",Good price good product,0.4754,1,work great,1345939200
972683275,"{0,0}",192,4.0,"<span class=""fa fa-star checked""></span><span class=""fa fa-star checked""></span><span class=""fa fa-star checked""></span><span class=""fa fa-star checked""></span><span class=""fa fa-star""></span>","Fits many different size TV's,  is very solid, and was easy to install.  I would recommend to anyone is even slightly handy.","02 15, 2013",A1OY33KGOG3IX8,Robert Brasseur,0.7425,"<span style=""background-color: #FFFF00"">Fits many different size TV's,  is very solid, and was easy to install.</span> I would recommend to anyone is even slightly handy.",Good Product,0.7425,2,install easy,1360886400
972683275,"{0,0}",185,5.0,"<span class=""fa fa-star checked""></span><span class=""fa fa-star checked""></span><span class=""fa fa-star checked""></span><span class=""fa fa-star checked""></span><span class=""fa fa-star checked""></span>",This product is user friendly and versatile.It is easy to install and comes with everything needed for installation.Adding bidding could drill and bit,"02 25, 2013",A2RE73VUCARNE0,Ramon Pereyra,0.7269,"<span style=""background-color: #FFFF00"">This product is user friendly and versatile.It is easy to install and comes with everything needed for installation.Adding bidding could drill and bit</span>",Very good,0.7269,2,install easy,1361750400
972683275,"{0,0}",45,5.0,"<span class=""fa fa-star checked""></span><span class=""fa fa-star checked""></span><span class=""fa fa-star checked""></span><span class=""fa fa-star checked""></span><span class=""fa fa-star checked""></span>",This mount is easy to install and very sturdy and is very functional and very affordable for the price. A+,"04 25, 2013",A20Q4FIBCAG2ZV,cameron,0.4404,"<span style=""background-color: #FFFF00"">This mount is easy to install and very sturdy and is very functional and very affordable for the price.</span> A+",great product,0.4404,2,install easy,1366848000
972683275,"{1,1}",186,5.0,"<span class=""fa fa-star checked""></span><span class=""fa fa-star checked""></span><span class=""fa fa-star checked""></span><span class=""fa fa-star checked""></span><span class=""fa fa-star checked""></span>",it was so easy to install.  the instructions were simple and so was the process.  i was putting off the project for fear.  i should have hung the TV long ago.,"03 8, 2013",A3KHBD3YRNY5WO,Randy Williams,0.1384,"<span style=""background-color: #FFFF00"">it was so easy to install.</span> the instructions were simple and so was the process. i was putting off the project for fear. i should have hung the TV long ago.",perfect in every way,0.1384,2,install easy,1362700800
972683275,"{0,0}",102,5.0,"<span class=""fa fa-star checked""></span><span class=""fa fa-star checked""></span><span class=""fa fa-star checked""></span><span class=""fa fa-star checked""></span><span class=""fa fa-star checked""></span>",UPDATE: I have now have purchased 3 of these for work and home and with the lighter LED TV's this is a perfect mount for most sizes - this is a great mount - easy to install - easy to use - easy to expand - easy to mount TVs. I havent found another one that is so useful - even if you dont need it to extend this is still a great mount--- I guess for the price I was expecting something cheaper but I was quite surprised. It was easy to install and works for what I need it for - it may be over kill for a 22 inch LED LCD TV but I like the way it can be moved around.,"12 29, 2010",A1VA1QF8KZNBLL,Jeff Lawrence,0.9514,"<span style=""background-color: #FFFF00"">UPDATE: I have now have purchased 3 of these for work and home and with the lighter LED TV's this is a perfect mount for most sizes - this is a great mount - easy to install - easy to use - easy to expand - easy to mount TVs.</span> I havent found another one that is so useful - even if you dont need it to extend this is still a great mount--- I guess for the price I was expecting something cheaper but I was quite surprised. <span style=""background-color: #FFFF00"">It was easy to install and works for what I need it for - it may be over kill for a 22 inch LED LCD TV but I like the way it can be moved around.</span>",the only mount I will buy,0.9514,2,install easy,1293580800
972683275,"{0,0}",173,5.0,"<span class=""fa fa-star checked""></span><span class=""fa fa-star checked""></span><span class=""fa fa-star checked""></span><span class=""fa fa-star checked""></span><span class=""fa fa-star checked""></span>","I have mounted a 42 inch old LCD. Easy to install. Easy to swivel, there is tilt option but it has to be locked by nuts(it can not be changed without loosing the nuts).","01 14, 2013",A3EP4YIS9W1LR1,Nitkad,0.4404,"I have mounted a 42 inch old LCD. <span style=""background-color: #FFFF00"">Easy to install.</span> <span style=""background-color: #FFFF00"">Easy to swivel, there is tilt option but it has to be locked by nuts(it can not be changed without loosing the nuts).</span>",Good for price,0.0,2,install easy,1358121600
972683275,"{0,0}",184,5.0,"<span class=""fa fa-star checked""></span><span class=""fa fa-star checked""></span><span class=""fa fa-star checked""></span><span class=""fa fa-star checked""></span><span class=""fa fa-star checked""></span>","had a couple of guys put this up for me, but they said it was easy to install. I like the fact that I can move it around easily and tilt it anyway I want it to be.","03 11, 2014",A326UIIB1O2UUR,Rachel Maggert,0.8922,"<span style=""background-color: #FFFF00"">had a couple of guys put this up for me, but they said it was easy to install.</span> I like the fact that I can move it around easily and tilt it anyway I want it to be.",easy to install,0.8922,2,install easy,1394496000
972683275,"{0,0}",87,5.0,"<span class=""fa fa-star checked""></span><span class=""fa fa-star checked""></span><span class=""fa fa-star checked""></span><span class=""fa fa-star checked""></span><span class=""fa fa-star checked""></span>","I have a 47&#34; TV and had no place to put it in my bed room. With this mount it use the space i had a poster hanging. Very easy to install, came with all hard ware.","02 15, 2013",A27OMVFGJXH1VB,Goneanddidit,0.1513,"I have a 47&#34; TV and had no place to put it in my bed room. With this mount it use the space i had a poster hanging. <span style=""background-color: #FFFF00"">Very easy to install, came with all hard ware.</span>",Got Room?,0.0772,2,install easy,1360886400
972683275,"{0,0}",140,5.0,"<span class=""fa fa-star checked""></span><span class=""fa fa-star checked""></span><span class=""fa fa-star checked""></span><span class=""fa fa-star checked""></span><span class=""fa fa-star checked""></span>",Awesome price and quality. Simple and easy to install and fully equipped for installation. If you need a swing arm mount for medium size tv this is one I'd recommend.,"11 22, 2012",A1038957GWRBP375RU5T,leo,0.8591,"Awesome price and quality. <span style=""background-color: #FFFF00"">Simple and easy to install and fully equipped for installation.</span> If you need a swing arm mount for medium size tv this is one I'd recommend.",Great item,0.8591,2,install easy,1353542400
972683275,"{0,0}",80,5.0,"<span class=""fa fa-star checked""></span><span class=""fa fa-star checked""></span><span class=""fa fa-star checked""></span><span class=""fa fa-star checked""></span><span class=""fa fa-star checked""></span>","Very good item; I am happy wit it, and delivery time was excellent!!  I recomended; is a good support for your LED TV. It is easy to install, and it have extra screws for different sizes TV.","05 2, 2012",A24OHQK700QEIW,Fredy,0.9582,"Very good item; I am happy wit it, and delivery time was excellent!! I recomended; is a good support for your LED TV. <span style=""background-color: #FFFF00"">It is easy to install, and it have extra screws for different sizes TV.</span>",Very good!!,0.9582,2,install easy,1335916800
972683275,"{0,0}",29,5.0,"<span class=""fa fa-star checked""></span><span class=""fa fa-star checked""></span><span class=""fa fa-star checked""></span><span class=""fa fa-star checked""></span><span class=""fa fa-star checked""></span>",I am very glad for buying it.  It is heavy duty and good quality for the price.  It was very easy to install.,"01 9, 2013",A3CCITVF0WL6KE,A. Ramos,0.855,"<span style=""background-color: #FFFF00"">I am very glad for buying it.</span> <span style=""background-color: #FFFF00"">It is heavy duty and good quality for the price.</span> It was very easy to install.",VideoSecu Swing Arm TV Wall Mount,0.855,3,good price buy,1357689600
972683275,"{0,0}",93,5.0,"<span class=""fa fa-star checked""></span><span class=""fa fa-star checked""></span><span class=""fa fa-star checked""></span><span class=""fa fa-star checked""></span><span class=""fa fa-star checked""></span>",We bought this for a 55&#34; Vizio and it worked perfectly. I would buy it again and recommend it. Good quality.,"01 2, 2014",A110S8IJ3ZID0D,Jake,0.8625,"We bought this for a 55&#34; Vizio and it worked perfectly. <span style=""background-color: #FFFF00"">I would buy it again and recommend it.</span> <span style=""background-color: #FFFF00"">Good quality.</span>","Worked great for 55"" Vizio",0.7717,3,good price buy,1388620800
972683275,"{0,0}",78,4.0,"<span class=""fa fa-star checked""></span><span class=""fa fa-star checked""></span><span class=""fa fa-star checked""></span><span class=""fa fa-star checked""></span><span class=""fa fa-star""></span>",this is a good product.  It went up easily.  I did it myself.  I wish I might have gotten one with a little more adjustment.  It's very rigid.,"01 3, 2013",A3Q7DHKIU7TMBI,follownobody,0.7357,"<span style=""background-color: #FFFF00"">this is a good product.</span> It went up easily. I did it myself. I wish I might have gotten one with a little more adjustment. It's very rigid.",for my office tv,0.7357,3,good price buy,1357171200
972683275,"{0,0}",37,5.0,"<span class=""fa fa-star checked""></span><span class=""fa fa-star checked""></span><span class=""fa fa-star checked""></span><span class=""fa fa-star checked""></span><span class=""fa fa-star checked""></span>","very heavy duty construction, extends, tilts perfectlya steal at this pricewill be happy to buy another 1 or 2 if needed","11 25, 2012",A5O0P0JV6PLU3,bone,0.25,"<span style=""background-color: #FFFF00"">very heavy duty construction, extends, tilts perfectlya steal at this pricewill be happy to buy another 1 or 2 if needed</span>",deal!,0.25,3,good price buy,1353801600
972683275,"{0,0}",43,3.0,"<span class=""fa fa-star checked""></span><span class=""fa fa-star checked""></span><span class=""fa fa-star checked""></span><span class=""fa fa-star""></span><span class=""fa fa-star""></span>","For the price, you can't beat it. Mine didn't come with any of the screws for the TV, but luckily I had some leftover from another mount so I didn't want to bother returning it. Also, not sure what they mean by tilt, but mine doesn't. The arm extends in and out as said, tv swivels left to right, but does not tilt up and down as was my expectation. Otherwise, can't beat it for the price as in Target/Best Buy etc., these are going for $60+.","07 12, 2011",A3VKO21KYDJQ2W,C. Aaland,0.4128,"<span style=""background-color: #FFFF00"">For the price, you can't beat it.</span> Mine didn't come with any of the screws for the TV, but luckily I had some leftover from another mount so I didn't want to bother returning it. Also, not sure what they mean by tilt, but mine doesn't. The arm extends in and out as said, tv swivels left to right, but does not tilt up and down as was my expectation. <span style=""background-color: #FFFF00"">Otherwise, can't beat it for the price as in Target/Best Buy etc., these are going for $60+.</span>",Great for the price.,0.4128,3,good price buy,1310428800
972683275,"{0,0}",152,4.0,"<span class=""fa fa-star checked""></span><span class=""fa fa-star checked""></span><span class=""fa fa-star checked""></span><span class=""fa fa-star checked""></span><span class=""fa fa-star""></span>",I bought this tv swing arm mount for my tv from amazon.Its been a good one its built heavy duty to hold pretty big tv .I would have anyone of my friends buy this same mount for their tv. It lets you hang it up and out of the way and also you can turn it out or in adjustable to see it from anywhere I set in my living room. This unit is easy to mount on wall and put together by yourself but if you have an extra person around it would make it a little better when holding the tv up when it clips in at top then screw and tighten and adjustments and like everything else I've bought from amazon it ships fast right to your door step.,"03 28, 2013",A8THC8D64F5E3,Mbk,0.9367,"<span style=""background-color: #FFFF00"">I bought this tv swing arm mount for my tv from amazon.Its been a good one its built heavy duty to hold pretty big tv .I would have anyone of my friends buy this same mount for their tv.</span> It lets you hang it up and out of the way and also you can turn it out or in adjustable to see it from anywhere I set in my living room. This unit is easy to mount on wall and put together by yourself but if you have an extra person around it would make it a little better when holding the tv up when it clips in at top then screw and tighten and adjustments and like everything else I've bought from amazon it ships fast right to your door step.",My new tv wall mount,0.9367,3,good price buy,1364428800
972683275,"{0,0}",23,5.0,"<span class=""fa fa-star checked""></span><span class=""fa fa-star checked""></span><span class=""fa fa-star checked""></span><span class=""fa fa-star checked""></span><span class=""fa fa-star checked""></span>",for the price you just cant beat this item. I bought it for a house I was selling so I could hang some tv and it worked great. Good quality for the price.,"05 12, 2013",A3UOSOCRKS3WIH,Allen Coberly,0.7906,"<span style=""background-color: #FFFF00"">for the price you just cant beat this item.</span> I bought it for a house I was selling so I could hang some tv and it worked great. <span style=""background-color: #FFFF00"">Good quality for the price.</span>",Cant Beat it!,0.6249,3,good price buy,1368316800
972683275,"{0,0}",113,4.0,"<span class=""fa fa-star checked""></span><span class=""fa fa-star checked""></span><span class=""fa fa-star checked""></span><span class=""fa fa-star checked""></span><span class=""fa fa-star""></span>","Amazon as always 5 stars in service and shipping.The mount was for a VIZIO E260MV 26-Inch. Product comes adequate with a lot of screws, an Alan key and standard nut key that fits all the nuts. The bubble level (with magnet on the side) and cable are a nice addition.Had to cut 1 inch from the top and bottom of the base that gets screwed no to the TV, since it covered some of the inputs. Other wise very practical for my bedroom/Study that has more width so the convenience of swirling is why we wanted this and it does a good job.For the price ($25 and free shipping), its is a really good deal. Would recommend this.","11 10, 2011",A3DOQ1AI1MU74K,jmindito,0.8779,"Amazon as always 5 stars in service and shipping.The mount was for a VIZIO E260MV 26-Inch. Product comes adequate with a lot of screws, an Alan key and standard nut key that fits all the nuts. The bubble level (with magnet on the side) and cable are a nice addition.Had to cut 1 inch from the top and bottom of the base that gets screwed no to the TV, since it covered some of the inputs. <span style=""background-color: #FFFF00"">Other wise very practical for my bedroom/Study that has more width so the convenience of swirling is why we wanted this and it does a good job.For the price ($25 and free shipping), its is a really good deal.</span> Would recommend this.","Nice Flexiable mount, had to cut to fit VIZIO E260MV 26""",0.8779,3,good price buy,1320883200
972683275,"{18,23}",221,5.0,"<span class=""fa fa-star checked""></span><span class=""fa fa-star checked""></span><span class=""fa fa-star checked""></span><span class=""fa fa-star checked""></span><span class=""fa fa-star checked""></span>","Do not listen to other reviewers, screws that this came with are concrete only, there are no wood or dry wall screws. You will!!!! need a stud finder!!! There are 8 holes in total on a mounting plate, so it is plenty enough if you hit the center of a stud. Sturdy,good looking. There is a whole set of machine screws for(my guess)all TV types plus couple of tools that you will need.","10 12, 2010",AGY0KH2D5G9WH,"Thomas ""TC""",-0.8109999999999999,"<span style=""background-color: #FFFF00"">Do not listen to other reviewers, screws that this came with are concrete only, there are no wood or dry wall screws.</span> You will!!!! <span style=""background-color: #FFFF00"">need a stud finder!!!</span> <span style=""background-color: #FFFF00"">There are 8 holes in total on a mounting plate, so it is plenty enough if you hit the center of a stud.</span> Sturdy,good looking. <span style=""background-color: #FFFF00"">There is a whole set of machine screws for(my guess)all TV types plus couple of tools that you will need.</span>",Excellent mount,-0.7482,4,stud plate screw,1286841600
972683275,"{0,0}",235,3.0,"<span class=""fa fa-star checked""></span><span class=""fa fa-star checked""></span><span class=""fa fa-star checked""></span><span class=""fa fa-star""></span><span class=""fa fa-star""></span>","received the product and got it installed today. for the most part I am pretty happy with the hardware except the materials being used to make screws or other parts. the screws get very easily damaged by the most commonly used screw drivers that you can find for $1 per piece.  Once I put the bolt into the LCD TV and mount it with the plate, I found myself having a hardtime removing the screw because the tread mark on the screw head is already messed by by the screw driver, which makes me doubt about the material being used on the mount and arms.  is the material used on the mount going to deliver the same quality as the bolts and nuts?","12 29, 2012",A1L0MEXMESE4C4,Xpert,-0.7332,"received the product and got it installed today. <span style=""background-color: #FFFF00"">for the most part I am pretty happy with the hardware except the materials being used to make screws or other parts.</span> <span style=""background-color: #FFFF00"">the screws get very easily damaged by the most commonly used screw drivers that you can find for $1 per piece.</span> <span style=""background-color: #FFFF00"">Once I put the bolt into the LCD TV and mount it with the plate, I found myself having a hardtime removing the screw because the tread mark on the screw head is already messed by by the screw driver, which makes me doubt about the material being used on the mount and arms.</span> is the material used on the mount going to deliver the same quality as the bolts and nuts?",just got it installed,-0.7332,4,stud plate screw,1356739200
972683275,"{0,0}",77,5.0,"<span class=""fa fa-star checked""></span><span class=""fa fa-star checked""></span><span class=""fa fa-star checked""></span><span class=""fa fa-star checked""></span><span class=""fa fa-star checked""></span>","We got this one recently and its a great wall mount. The unit is pretty heavy, so you will need a helper. It also includes a variety of screws to mount also. Our TV documentation stated it was a 400x400 pattern. But after putting hte plate over the back, seems we didn't need the extra extenders as its 200x200. This is on a Samsung 40&#34; 5000 series LEDTV.The arm is hard to push and pull, but that is more due to being new and stiff. Make sure you adjust the tilt angle screws as our unit came with them loose so we had to tighten them.I initially was scared to mount it (what if it falls if I screw up!!!) but its pretty easy. Not only did i use a stud finder to get the general location of the stud, but i also used nails to get the actual edges (those basic studfinders are never &#34;exact&#34;). make sure you do the same.not bad for $30-ish","08 19, 2013",A1V8UZ63FQD382,"FL Guy ""FL Guy""",0.6028,"We got this one recently and its a great wall mount. The unit is pretty heavy, so you will need a helper. <span style=""background-color: #FFFF00"">It also includes a variety of screws to mount also.</span> Our TV documentation stated it was a 400x400 pattern. <span style=""background-color: #FFFF00"">But after putting hte plate over the back, seems we didn't need the extra extenders as its 200x200.</span> This is on a Samsung 40&#34; 5000 series LEDTV.The arm is hard to push and pull, but that is more due to being new and stiff. <span style=""background-color: #FFFF00"">Make sure you adjust the tilt angle screws as our unit came with them loose so we had to tighten them.I initially was scared to mount it (what if it falls if I screw up!!!)</span> but its pretty easy. <span style=""background-color: #FFFF00"">Not only did i use a stud finder to get the general location of the stud, but i also used nails to get the actual edges (those basic studfinders are never &#34;exact&#34;).</span> make sure you do the same.not bad for $30-ish",Great product,0.6028,4,stud plate screw,1376870400
972683275,"{0,0}",208,4.0,"<span class=""fa fa-star checked""></span><span class=""fa fa-star checked""></span><span class=""fa fa-star checked""></span><span class=""fa fa-star checked""></span><span class=""fa fa-star""></span>","Very simple set up and ease of installation. I followed the advice of another reviewer and removed the top hex-screw of one of the center connections (thus disconnecting the wall plate from the plate attached to the TV)so that I could install the plate to the wall and the plate to the back of the TV as separate processes. Both simple and quite easy. Then it was simply a matter of slipping the two back together and re-installing the hex-screw. I was able to install a 32"" RCA TV, without any help in less than 20 minutes.Manufacturer provided a good assortment of screws and other hardware, as well as a hex wrench, a small open wrench and a level.","12 25, 2011",APRP1LWB08YG8,SkipB,0.8092,"Very simple set up and ease of installation. <span style=""background-color: #FFFF00"">I followed the advice of another reviewer and removed the top hex-screw of one of the center connections (thus disconnecting the wall plate from the plate attached to the TV)so that I could install the plate to the wall and the plate to the back of the TV as separate processes.</span> Both simple and quite easy. <span style=""background-color: #FFFF00"">Then it was simply a matter of slipping the two back together and re-installing the hex-screw.</span> <span style=""background-color: #FFFF00"">I was able to install a 32"" RCA TV, without any help in less than 20 minutes.Manufacturer provided a good assortment of screws and other hardware, as well as a hex wrench, a small open wrench and a level.</span>",Solid product,0.8092,4,stud plate screw,1324771200
