asin,helpful,index,overall,overall_html,reviewText,reviewTime,reviewerID,reviewerName,sentiment,summarized_reviewText,summary,summary_sentiment,topic,topic_words,unixReviewTime
972683275,"{0,2}",68,2.0,"<span class=""fa fa-star checked""></span><span class=""fa fa-star checked""></span><span class=""fa fa-star""></span><span class=""fa fa-star""></span><span class=""fa fa-star""></span>","The mount plate and the extender arms need to be screwed together and there are two holes for each arm to attach to the corner of the plate. The holes don't align so I couldn't put two screws in. I just used one screw which is not the most secure attachment. Then I used zip ties to secure the arm better. I did this because I had to install the tv ASAP and could not wait for a replacement. Also, the mounting bracket that attaches to the wall has a larger screw hole on the bottom. This means that the bottom can wiggle and the bracket will be misaligned. Again, I did a quick fix. I gave this 2 stars and not 1 because it actually stayed up on the wall and is now holding my tv, albeit due to my own ingenuity and not the quality of the mount. I should not have to do quick fixes on a product like this.","12 17, 2012",A2LR9WP2JGDT8E,E. Coronel,0.0291,"<span style=""background-color: #FFFF00"">The mount plate and the extender arms need to be screwed together and there are two holes for each arm to attach to the corner of the plate.</span> <span style=""background-color: #FFFF00"">The holes don't align so I couldn't put two screws in.</span> <span style=""background-color: #FFFF00"">I just used one screw which is not the most secure attachment.</span> Then I used zip ties to secure the arm better. I did this because I had to install the tv ASAP and could not wait for a replacement. <span style=""background-color: #FFFF00"">Also, the mounting bracket that attaches to the wall has a larger screw hole on the bottom.</span> This means that the bottom can wiggle and the bracket will be misaligned. Again, I did a quick fix. I gave this 2 stars and not 1 because it actually stayed up on the wall and is now holding my tv, albeit due to my own ingenuity and not the quality of the mount. I should not have to do quick fixes on a product like this.",screw holes don't align,-0.3325,4,stud plate screw,1355702400
972683275,"{1,1}",203,5.0,"<span class=""fa fa-star checked""></span><span class=""fa fa-star checked""></span><span class=""fa fa-star checked""></span><span class=""fa fa-star checked""></span><span class=""fa fa-star checked""></span>","This was needed to mount a 32"" LCD that weighs 27 lbs in my bedroom. I looked at another mount by the same company but it did not articulate so I was worried I wouldn't be able to achieve the viewing angles that I needed. So I found this one & went w/ it based on the high reviews. I could not be more pleased.1) PRICE - If you were to go to the big electronics store (BB) or the big box monster (WM) you would pay hundreds. I can't fathom those more expensive mounts doing anything that this one does not. Does it cook dinner for me? Why pay $100-$250 for a mount when you can get this one for $29.99 & oh, by the way have the confidence in 898 customer reviews averaging 4.5 stars at the time of this writing?2) FUNCTION - This mount is solid. It articulates to the left, to the right. It pans, it tilts. One small negative.....the plastic clips for routing wires are nearly useless. I took them off.3) WHATS IN THE BOX - Normally I would not comment on what an item comes with but in this case I was so impressed I felt it was worth mentioning. It comes w/ everything you need in neatly sealed and labeled plastic sleeves. It comes w/ lag bolts that everyone will use to mount to the wall stud. (mounting to a wall stud is required unless you are mounting to concrete) Then it has 9 different screw sets to mount the plate to the back of your TV. It has 2 washer sets for the mounting plate (based on if your TV has a flat or curved back). Then it has a spanner wrench for tightening the screw of the mounting plate. Then it also has 2 plastic anchors for mounting to a concrete wall. Last but not least are the VESA adaptors (which I did not need)4) WHAT YOU NEED THAT ISN'T INCLUDED -  Pencil / Level / Stud finder / Phillips screwdriver / Drill w/ a 7/32 drill bit / Socket wrench w/ a 13mm attachment.5) CONCLUSION - This is a no brainer. I have another 32"" that needs mounted. I think as soon as I click publish for this review I will be ordering another one. If you find yourself reading reviews on TV mounts and you have found this one your search is over, just click buy already.","01 3, 2014",A23S2XCWFZM976,Sauce On Side,0.4366,"This was needed to mount a 32"" LCD that weighs 27 lbs in my bedroom. I looked at another mount by the same company but it did not articulate so I was worried I wouldn't be able to achieve the viewing angles that I needed. So I found this one & went w/ it based on the high reviews. I could not be more pleased.1) PRICE - If you were to go to the big electronics store (BB) or the big box monster (WM) you would pay hundreds. I can't fathom those more expensive mounts doing anything that this one does not. Does it cook dinner for me? Why pay $100-$250 for a mount when you can get this one for $29.99 & oh, by the way have the confidence in 898 customer reviews averaging 4.5 stars at the time of this writing?2) FUNCTION - This mount is solid. It articulates to the left, to the right. It pans, it tilts. One small negative.....the plastic clips for routing wires are nearly useless. I took them off.3) WHATS IN THE BOX - Normally I would not comment on what an item comes with but in this case I was so impressed I felt it was worth mentioning. It comes w/ everything you need in neatly sealed and labeled plastic sleeves. <span style=""background-color: #FFFF00"">It comes w/ lag bolts that everyone will use to mount to the wall stud.</span> <span style=""background-color: #FFFF00"">(mounting to a wall stud is required unless you are mounting to concrete) Then it has 9 different screw sets to mount the plate to the back of your TV.</span> <span style=""background-color: #FFFF00"">It has 2 washer sets for the mounting plate (based on if your TV has a flat or curved back).</span> <span style=""background-color: #FFFF00"">Then it has a spanner wrench for tightening the screw of the mounting plate.</span> Then it also has 2 plastic anchors for mounting to a concrete wall. <span style=""background-color: #FFFF00"">Last but not least are the VESA adaptors (which I did not need)4) WHAT YOU NEED THAT ISN'T INCLUDED -  Pencil / Level / Stud finder / Phillips screwdriver / Drill w/ a 7/32 drill bit / Socket wrench w/ a 13mm attachment.5) CONCLUSION - This is a no brainer.</span> I have another 32"" that needs mounted. I think as soon as I click publish for this review I will be ordering another one. If you find yourself reading reviews on TV mounts and you have found this one your search is over, just click buy already.",Awesome TV mount,0.4366,4,stud plate screw,1388707200
972683275,"{0,0}",96,4.0,"<span class=""fa fa-star checked""></span><span class=""fa fa-star checked""></span><span class=""fa fa-star checked""></span><span class=""fa fa-star checked""></span><span class=""fa fa-star""></span>","Very well made, strong mount the only problem I have is the instructions are very poorly written or detailed. Pictures do not distinguish between Stud mount and concrete. Also the instructions do not tell you the size of the included boltsFor those of you who have never worked in the home building industry wall studs are usually 1.5 inches wide so this mount only requires 2 lag bolts in the middle holes to secure it to the wall to support a 23 lb TV. The four outboard holes on the wall mount are 1.3"" apart so don't try to use them in a wall stud measuring 1.5"" wide.Helpful hint: I have help install at least 6 other wall mounts because of family or friends so I cannot say that I am an expert but my suggestion is to drill pilot holes which the instructions do not tell you to do.After comparing the instructions on this unit to others I have installed I still must say that the pictures should have a lot more detail. Some complain that the back plate was too big for the TV they used but it's fits perfect on theLG 32LK450 32-Inch 1080p 60Hz LCD HDTVI am using it on.Works perfectly for the area of the room I am using it in which allows me to rearrange the room without the need to move the TV.","10 22, 2011",A180BZHVJIRWBZ,James Mac,0.9335,"Very well made, strong mount the only problem I have is the instructions are very poorly written or detailed. <span style=""background-color: #FFFF00"">Pictures do not distinguish between Stud mount and concrete.</span> <span style=""background-color: #FFFF00"">Also the instructions do not tell you the size of the included boltsFor those of you who have never worked in the home building industry wall studs are usually 1.5 inches wide so this mount only requires 2 lag bolts in the middle holes to secure it to the wall to support a 23 lb TV.</span> <span style=""background-color: #FFFF00"">The four outboard holes on the wall mount are 1.3"" apart so don't try to use them in a wall stud measuring 1.5"" wide.Helpful hint: I have help install at least 6 other wall mounts because of family or friends so I cannot say that I am an expert but my suggestion is to drill pilot holes which the instructions do not tell you to do.After comparing the instructions on this unit to others I have installed I still must say that the pictures should have a lot more detail.</span> <span style=""background-color: #FFFF00"">Some complain that the back plate was too big for the TV they used but it's fits perfect on theLG 32LK450 32-Inch 1080p 60Hz LCD HDTVI am using it on.Works perfectly for the area of the room I am using it in which allows me to rearrange the room without the need to move the TV.</span>","Very well made, strong mount.",0.938,4,stud plate screw,1319241600
972683275,"{0,0}",39,4.0,"<span class=""fa fa-star checked""></span><span class=""fa fa-star checked""></span><span class=""fa fa-star checked""></span><span class=""fa fa-star checked""></span><span class=""fa fa-star""></span>","I used it to mount a 32"" LCD TV to the wall... about 28LBS.  I installed it in less than 1/2 hour and am very happy with the results.PROS:-Comes with all of the hardware you'll need-Comes with some extra hardware of which I have NO IDEA what it is there for.  I suspect it's a 'universal' hardware pack for several models and not all hardware is used for all models, but it's nice to have a little 'extra' (which is always better than not enough!)-The included Level is nice... well it's cheap but it works!-The instructions did a decent enough job of explaining how to install the unit.CONS:-Metal is just a tad on the flimsy side.  I have no problems trusting it with my &lt;30lb television but if I were to mount something closer to its maximum rated weight of 55lbs, I think I would be quite a bit nervous about it holding up.-The holes in the base were just a little bit too wide for my wall stud.  I think the particular stud I was installing it onto was a typical 2X4 and if centered, the left and right side holes were just a little too far to grab both sides of the stud.  I had to reposition it so that the center holes were aligned to the left side of the stud, and that the right side holes were aligned to the right side of the stud.  As a result, I was only able to install four of the six bolts to hold it in place, but I don't feel it will be an issue with my 28LB television.  If your house uses wider studs this probably wouldn't even be an issue.-The metal does sag just a little bit with the weight of the television on it.  I mounted the base just a little bit ""off level"" to help compensate for this, and had no problems getting the television level using the adjustments available to me.CONCLUSION:  All in all It's not a bad unit.. ESPECIALLY for the price.  Yes I would have liked to see a sturdier unit, but when you take into account the &lt;$30 price tag, it's an excellent bargain.  I don't think I'll have any issue with a static mounting of my TV in the corner of the bedroom *BUT* if you are considering installing this unit for a television that will see a lot of traffic, constant repositioning, etc... then you might want to spend more money on something sturdier.","05 31, 2011",A2KQDWZZUBBNOJ,Bradley Pool,0.9711,"I used it to mount a 32"" LCD TV to the wall... about 28LBS. I installed it in less than 1/2 hour and am very happy with the results.PROS:-Comes with all of the hardware you'll need-Comes with some extra hardware of which I have NO IDEA what it is there for. I suspect it's a 'universal' hardware pack for several models and not all hardware is used for all models, but it's nice to have a little 'extra' (which is always better than not enough! )-The included Level is nice... well it's cheap but it works!-The instructions did a decent enough job of explaining how to install the unit.CONS:-Metal is just a tad on the flimsy side. <span style=""background-color: #FFFF00"">I have no problems trusting it with my &lt;30lb television but if I were to mount something closer to its maximum rated weight of 55lbs, I think I would be quite a bit nervous about it holding up.-The holes in the base were just a little bit too wide for my wall stud.</span> <span style=""background-color: #FFFF00"">I think the particular stud I was installing it onto was a typical 2X4 and if centered, the left and right side holes were just a little too far to grab both sides of the stud.</span> <span style=""background-color: #FFFF00"">I had to reposition it so that the center holes were aligned to the left side of the stud, and that the right side holes were aligned to the right side of the stud.</span> As a result, I was only able to install four of the six bolts to hold it in place, but I don't feel it will be an issue with my 28LB television. <span style=""background-color: #FFFF00"">If your house uses wider studs this probably wouldn't even be an issue.-The metal does sag just a little bit with the weight of the television on it.</span> I mounted the base just a little bit ""off level"" to help compensate for this, and had no problems getting the television level using the adjustments available to me.CONCLUSION:  All in all It's not a bad unit.. ESPECIALLY for the price. Yes I would have liked to see a sturdier unit, but when you take into account the &lt;$30 price tag, it's an excellent bargain. I don't think I'll have any issue with a static mounting of my TV in the corner of the bedroom *BUT* if you are considering installing this unit for a television that will see a lot of traffic, constant repositioning, etc... then you might want to spend more money on something sturdier.",It works!,0.9711,4,stud plate screw,1306800000
972683275,"{0,0}",103,4.0,"<span class=""fa fa-star checked""></span><span class=""fa fa-star checked""></span><span class=""fa fa-star checked""></span><span class=""fa fa-star checked""></span><span class=""fa fa-star""></span>",Used this for the bedroom. Put it in the corner but was only able to hit the stud with a couple bolts.,"04 29, 2013",A1QKUDP9EUHJXH,Jennifer Ingberg,0.0,"Used this for the bedroom. <span style=""background-color: #FFFF00"">Put it in the corner but was only able to hit the stud with a couple bolts.</span>",Insignia,0.0,4,stud plate screw,1367193600
972683275,"{0,0}",132,5.0,"<span class=""fa fa-star checked""></span><span class=""fa fa-star checked""></span><span class=""fa fa-star checked""></span><span class=""fa fa-star checked""></span><span class=""fa fa-star checked""></span>","For a good wall mount of a smaller TV, this is perfect. Much cheaper than similar in various stores, and actually is more flush/compact than I have seen on others with all the adjustments you could want.Only gripe is that the included wrench to tighten the wall bolts is pretty weak and strips itself almost immediately, but it'll work to get it on at least. All hardware needed is included, I had to use a few adapter pieces on my first TV. Getting ready to hook a second one up on another rooms wall, both are 32"" screens. I feel confident they will be there until I decide to remove em.Wall stud mounting required, but depending on the stud size, you may only get two of the three wall bolts into the stud. Should be enough though.","05 25, 2012",A21OS6PWQG5YOO,Kevin B.,0.9001,"For a good wall mount of a smaller TV, this is perfect. Much cheaper than similar in various stores, and actually is more flush/compact than I have seen on others with all the adjustments you could want.Only gripe is that the included wrench to tighten the wall bolts is pretty weak and strips itself almost immediately, but it'll work to get it on at least. All hardware needed is included, I had to use a few adapter pieces on my first TV. Getting ready to hook a second one up on another rooms wall, both are 32"" screens. <span style=""background-color: #FFFF00"">I feel confident they will be there until I decide to remove em.Wall stud mounting required, but depending on the stud size, you may only get two of the three wall bolts into the stud.</span> Should be enough though.",Liked it so much I bought another,0.9001,4,stud plate screw,1337904000
972683275,"{3,4}",223,4.0,"<span class=""fa fa-star checked""></span><span class=""fa fa-star checked""></span><span class=""fa fa-star checked""></span><span class=""fa fa-star checked""></span><span class=""fa fa-star""></span>","I'm using this to mount an older SyncMaster 191T above my desk and was pleasantly surprised at how sturdy it is for the price.  Installation was simple, though I used the screws from the original monitor mount for the plate attachment, as none of those included would work with my monitor.  The tilt mechanism requires loosening a bolt and then adjusting the monitor to the desired angle.  I would have preferred another 10-15 degrees of vertical tilting capability, but what is available will be fine for most applications.  I posted a couple of photos that shows it mounted.Overall I'm very pleased with the purchase and would buy again should I need to mount another small display.","09 18, 2010",AMAR6CIOZUQO4,T. McKendry,0.8831,"<span style=""background-color: #FFFF00"">I'm using this to mount an older SyncMaster 191T above my desk and was pleasantly surprised at how sturdy it is for the price.</span> <span style=""background-color: #FFFF00"">Installation was simple, though I used the screws from the original monitor mount for the plate attachment, as none of those included would work with my monitor.</span> <span style=""background-color: #FFFF00"">The tilt mechanism requires loosening a bolt and then adjusting the monitor to the desired angle.</span> I would have preferred another 10-15 degrees of vertical tilting capability, but what is available will be fine for most applications. <span style=""background-color: #FFFF00"">I posted a couple of photos that shows it mounted.Overall I'm very pleased with the purchase and would buy again should I need to mount another small display.</span>",Sturdy and an excellent value ...,0.8831,5,flat mount monitor,1284768000
972683275,"{0,1}",107,3.0,"<span class=""fa fa-star checked""></span><span class=""fa fa-star checked""></span><span class=""fa fa-star checked""></span><span class=""fa fa-star""></span><span class=""fa fa-star""></span>",My flat screem computer monitor is very light and didn't need such a heavy duty mount.  The product is fine and would work for monitors much larger and heavier than my 20&#34; LED,"03 8, 2013",A2RUN82QPU60PN,Jimbo,0.2023,"<span style=""background-color: #FFFF00"">My flat screem computer monitor is very light and didn't need such a heavy duty mount.</span> <span style=""background-color: #FFFF00"">The product is fine and would work for monitors much larger and heavier than my 20&#34; LED</span>",Much heavier than I expected,0.2023,5,flat mount monitor,1362700800
972683275,"{0,0}",61,4.0,"<span class=""fa fa-star checked""></span><span class=""fa fa-star checked""></span><span class=""fa fa-star checked""></span><span class=""fa fa-star checked""></span><span class=""fa fa-star""></span>","I'd never bought one of these, mainly due to the high prices in the retail stores.  I hadn't looked online much, and hadn't really needed a monitor mounting device until recently.This thing is well built, and it does the job.  It's not fancy but if you are just looking for an inexpensive way to hang a monitor (TV or PC) on the wall this will do the job.  It comes with a nice bag of heavy-duty hardware.  It is primarily designed for mounting TV sets, but you can get it to work with a PC monitor, as long as it has the VESA mounting.It mainly articulates side-to-side and in-and-out.  It'll pivot a bit up and down, but that's limited.","02 6, 2011",A13BWQDECDDVIZ,D. Jacobs,0.4404,"I'd never bought one of these, mainly due to the high prices in the retail stores. <span style=""background-color: #FFFF00"">I hadn't looked online much, and hadn't really needed a monitor mounting device until recently.This thing is well built, and it does the job.</span> <span style=""background-color: #FFFF00"">It's not fancy but if you are just looking for an inexpensive way to hang a monitor (TV or PC) on the wall this will do the job.</span> It comes with a nice bag of heavy-duty hardware. <span style=""background-color: #FFFF00"">It is primarily designed for mounting TV sets, but you can get it to work with a PC monitor, as long as it has the VESA mounting.It mainly articulates side-to-side and in-and-out.</span> It'll pivot a bit up and down, but that's limited.",VideoSecu,0.4404,5,flat mount monitor,1296950400
972683275,"{0,0}",189,4.0,"<span class=""fa fa-star checked""></span><span class=""fa fa-star checked""></span><span class=""fa fa-star checked""></span><span class=""fa fa-star checked""></span><span class=""fa fa-star""></span>","I have a 26"" LCD monitor mounted on unit.Seems sturdy enough, would prefer a more fluid motion and a way to adjust the pivot of the screen without tools.  As it is I keep it loose and it is reasonbly adjustable.For the price I certanily can't complain and would recommend this unit.","12 16, 2010",A2Y4H3PXB07WQI,Richard S. Sims,0.3204,"<span style=""background-color: #FFFF00"">I have a 26"" LCD monitor mounted on unit.Seems sturdy enough, would prefer a more fluid motion and a way to adjust the pivot of the screen without tools.</span> As it is I keep it loose and it is reasonbly adjustable.For the price I certanily can't complain and would recommend this unit.",Works as advertised.,0.3204,5,flat mount monitor,1292457600
972683275,"{0,0}",49,3.0,"<span class=""fa fa-star checked""></span><span class=""fa fa-star checked""></span><span class=""fa fa-star checked""></span><span class=""fa fa-star""></span><span class=""fa fa-star""></span>","Wanted the monitor off of the desk, so we mounted on the wall.  I would have rather had a vertical adjustment as well, but for the price, this unit does the job.","12 10, 2012",A3M6S7Y1FNPOLD,"Charlie Troutman ""Charlie""",0.1406,"<span style=""background-color: #FFFF00"">Wanted the monitor off of the desk, so we mounted on the wall.</span> I would have rather had a vertical adjustment as well, but for the price, this unit does the job.","for 25&#34; monitor, it worked well",0.1406,5,flat mount monitor,1355097600
972683275,"{0,0}",138,5.0,"<span class=""fa fa-star checked""></span><span class=""fa fa-star checked""></span><span class=""fa fa-star checked""></span><span class=""fa fa-star checked""></span><span class=""fa fa-star checked""></span>",Exactly as described.Very heavy duty.Lots of parts to make any installation work.Excellent value.Fits various monitors and tvs.,"01 3, 2013",AP7LSRPXT3ZL8,Kyle,0.0,"<span style=""background-color: #FFFF00"">Exactly as described.Very heavy duty.Lots of parts to make any installation work.Excellent value.Fits various monitors and tvs.</span>",Excellent!,0.0,5,flat mount monitor,1357171200
972683275,"{1,1}",19,5.0,"<span class=""fa fa-star checked""></span><span class=""fa fa-star checked""></span><span class=""fa fa-star checked""></span><span class=""fa fa-star checked""></span><span class=""fa fa-star checked""></span>",This mount is just what I needed.  It is strong and sturdy.  It folds almost flat to enable the television to sit square and flat against the wall if desired and extends and rotates for angle turns.  A perfect fit as long as you match the correct visa pattern for your television.,"04 30, 2013",A2IDCSC6NVONIZ,2Cents!,0.9022,"<span style=""background-color: #FFFF00"">This mount is just what I needed.</span> It is strong and sturdy. <span style=""background-color: #FFFF00"">It folds almost flat to enable the television to sit square and flat against the wall if desired and extends and rotates for angle turns.</span> A perfect fit as long as you match the correct visa pattern for your television.",Perfect,0.9022,5,flat mount monitor,1367280000
